"technique_id";"mitre_code";"technique_category";"technique_name";"technique_description";"tactic_code"
"mt0469";"T1556005";1;"Reversible Encryption";"An adversary may abuse Active Directory authentication encryption properties to gain access to credentials on Windows systems. The AllowReversiblePasswordEncryption property specifies whether reversible password encryption for an account is enabled or disabled. By default this property is disabled (instead storing user credentials as the output of one-way hashing functions) and should not be enabled unless legacy or other software require it.";"TA0005"
"mt0470";"T1556006";1;"Multi-Factor Authentication";"Adversaries may disable or modify multi-factor authentication (MFA) mechanisms to enable persistent access to compromised accounts.";"TA0005"
"mt0471";"T1556007";1;"Hybrid Identity";"Adversaries may patch, modify, or otherwise backdoor cloud authentication processes that are tied to on-premises user identities in order to bypass typical authentication mechanisms, access credentials, and enable persistent access to accounts.";"TA0005"
"mt0472";"T1556008";1;"Network Provider DLL";"Adversaries may register malicious network provider dynamic link libraries (DLLs) to capture cleartext user credentials during the authentication process. Network provider DLLs allow Windows to interface with specific network protocols and can also support add-on credential management functions. During the logon process, Winlogon (the interactive logon module) sends credentials to the local mpnotify.exe process via RPC. The mpnotify.exe process then shares the credentials in cleartext with registered credential managers when notifying that a logon event is happening.";"TA0005"
"mt0473";"T1556009";1;"Conditional Access Policies";"Adversaries may disable or modify conditional access policies to enable persistent access to compromised accounts. Conditional access policies are additional verifications used by identity providers and identity and access management systems to determine whether a user should be granted access to a resource.";"TA0005"
"mt0474";"T1578";1;"Modify Cloud Compute Infrastructure";"An adversary may attempt to modify a cloud account's compute service infrastructure to evade defenses. A modification to the compute service infrastructure can include the creation, deletion, or modification of one or more components such as compute instances, virtual machines, and snapshots.";"TA0005"
"mt0475";"T1578001";1;"Create Snapshot";"An adversary may create a snapshot or data backup within a cloud account to evade defenses. A snapshot is a point-in-time copy of an existing cloud compute component such as a virtual machine (VM), virtual hard drive, or volume. An adversary may leverage permissions to create a snapshot in order to bypass restrictions that prevent access to existing compute service infrastructure, unlike in Revert Cloud Instance where an adversary may revert to a snapshot to evade detection and remove evidence of their presence.";"TA0005"
"mt0476";"T1578002";1;"Create Cloud Instance";"An adversary may create a new instance or virtual machine (VM) within the compute service of a cloud account to evade defenses. Creating a new instance may allow an adversary to bypass firewall rules and permissions that exist on instances currently residing within an account. An adversary may Create Snapshot of one or more volumes in an account, create a new instance, mount the snapshots, and then apply a less restrictive security policy to collect Data from Local System or for Remote Data Staging.";"TA0005"
"mt0477";"T1578003";1;"Delete Cloud Instance";"An adversary may delete a cloud instance after they have performed malicious activities in an attempt to evade detection and remove evidence of their presence. Deleting an instance or virtual machine can remove valuable forensic artifacts and other evidence of suspicious behavior if the instance is not recoverable.";"TA0005"
"mt0478";"T1578004";1;"Revert Cloud Instance";"An adversary may revert changes made to a cloud instance after they have performed malicious activities in attempt to evade detection and remove evidence of their presence. In highly virtualized environments, such as cloud-based infrastructure, this may be accomplished by restoring virtual machine (VM) or data storage snapshots through the cloud management dashboard or cloud APIs.";"TA0005"
"mt0479";"T1578005";1;"Modify Cloud Compute Configurations";"Adversaries may modify settings that directly affect the size, locations, and resources available to cloud compute infrastructure in order to evade defenses. These settings may include service quotas, subscription associations, tenant-wide policies, or other configurations that impact available compute. Such modifications may allow adversaries to abuse the victim’s compute resources to achieve their goals, potentially without affecting the execution of running instances and/or revealing their activities to the victim.";"TA0005"
"mt0480";"T1112";1;"Modify Registry";"Adversaries may interact with the Windows Registry to hide configuration information within Registry keys, remove information as part of cleaning up, or as part of other techniques to aid in persistence and execution.";"TA0005"
"mt0481";"T1601";1;"Modify System Image";"Adversaries may make changes to the operating system of embedded network devices to weaken defenses and provide new capabilities for themselves. On such devices, the operating systems are typically monolithic and most of the device functionality and capabilities are contained within a single file.";"TA0005"
"mt0482";"T1601001";1;"Patch System Image";"Adversaries may modify the operating system of a network device to introduce new capabilities or weaken existing defenses. Some network devices are built with a monolithic architecture, where the entire operating system and most of the functionality of the device is contained within a single file. Adversaries may change this file in storage, to be loaded in a future boot, or in memory during runtime.";"TA0005"
"mt0483";"T1601002";1;"Downgrade System Image";"Adversaries may install an older version of the operating system of a network device to weaken security. Older operating system versions on network devices often have weaker encryption ciphers and, in general, fewer/less updated defensive features.";"TA0005"
"mt0484";"T1599";1;"Network Boundary Bridging";"Adversaries may bridge network boundaries by compromising perimeter network devices or internal devices responsible for network segmentation. Breaching these devices may enable an adversary to bypass restrictions on traffic routing that otherwise separate trusted and untrusted networks.";"TA0005"
"mt0485";"T1599001";1;"Network Address Translation Traversal";"Adversaries may bridge network boundaries by modifying a network device’s Network Address Translation (NAT) configuration. Malicious modifications to NAT may enable an adversary to bypass restrictions on traffic routing that otherwise separate trusted and untrusted networks.";"TA0005"
"mt0486";"T1027";1;"Obfuscated Files or Information";"Adversaries may attempt to make an executable or file difficult to discover or analyze by encrypting, encoding, or otherwise obfuscating its contents on the system or in transit. This is common behavior that can be used across different platforms and the network to evade defenses.";"TA0005"
"mt0487";"T1027001";1;"Binary Padding";"Adversaries may use binary padding to add junk data and change the on-disk representation of malware. This can be done without affecting the functionality or behavior of a binary, but can increase the size of the binary beyond what some security tools are capable of handling due to file size limitations.";"TA0005"
"mt0488";"T1027002";1;"Software Packing";"Adversaries may perform software packing or virtual machine software protection to conceal their code. Software packing is a method of compressing or encrypting an executable. Packing an executable changes the file signature in an attempt to avoid signature-based detection. Most decompression techniques decompress the executable code in memory. Virtual machine software protection translates an executable's original code into a special format that only a special virtual machine can run. A virtual machine is then called to run this code.";"TA0005"
"mt0489";"T1027003";1;"Steganography";"Adversaries may use steganography techniques in order to prevent the detection of hidden information. Steganographic techniques can be used to hide data in digital media such as images, audio tracks, video clips, or text files.";"TA0005"
"mt0490";"T1027004";1;"Compile After Delivery";"Adversaries may attempt to make payloads difficult to discover and analyze by delivering files to victims as uncompiled code. Text-based source code files may subvert analysis and scrutiny from protections targeting executables/binaries. These payloads will need to be compiled before execution, typically via native utilities such as csc.exe or GCC/MinGW.";"TA0005"
"mt0491";"T1027005";1;"Indicator Removal from Tools";"Adversaries may remove indicators from tools if they believe their malicious tool was detected, quarantined, or otherwise curtailed. They can modify the tool by removing the indicator and using the updated version that is no longer detected by the target's defensive systems or subsequent targets that may use similar systems.";"TA0005"
"mt0492";"T1027006";1;"HTML Smuggling";"Adversaries may smuggle data and files past content filters by hiding malicious payloads inside of seemingly benign HTML files. HTML documents can store large binary objects known as JavaScript Blobs (immutable data that represents raw bytes) that can later be constructed into file-like objects. Data may also be stored in Data URLs, which enable embedding media type or MIME files inline of HTML documents. HTML5 also introduced a download attribute that may be used to initiate file downloads.";"TA0005"
"mt0493";"T1027007";1;"Dynamic API Resolution";"Adversaries may obfuscate then dynamically resolve API functions called by their malware in order to conceal malicious functionalities and impair defensive analysis. Malware commonly uses various Native API functions provided by the OS to perform various tasks such as those involving processes, files, and other system artifacts.";"TA0005"
"mt0494";"T1027008";1;"Stripped Payloads";"Adversaries may attempt to make a payload difficult to analyze by removing symbols, strings, and other human readable information. Scripts and executables may contain variables names and other strings that help developers document code functionality. Symbols are often created by an operating system’s linker when executable payloads are compiled. Reverse engineers use these symbols and strings to analyze code and to identify functionality in payloads.";"TA0005"
"mt0495";"T1027009";1;"Embedded Payloads";"Adversaries may embed payloads within other files to conceal malicious content from defenses. Otherwise seemingly benign files (such as scripts and executables) may be abused to carry and obfuscate malicious payloads and content. In some cases, embedded payloads may also enable adversaries to Subvert Trust Controls by not impacting execution controls such as digital signatures and notarization tickets.";"TA0005"
"mt0496";"T1027010";1;"Command Obfuscation";"Adversaries may obfuscate content during command execution to impede detection. Command-line obfuscation is a method of making strings and patterns within commands and scripts more difficult to signature and analyze. This type of obfuscation can be included within commands executed by delivered payloads (e.g., Phishing and Drive-by Compromise) or interactively via Command and Scripting Interpreter.";"TA0005"
"mt0497";"T1027011";1;"Fileless Storage";"Adversaries may store data in ""fileless"" formats to conceal malicious activity from defenses. Fileless storage can be broadly defined as any format other than a file. Common examples of non-volatile fileless storage include the Windows Registry, event logs, or WMI repository.";"TA0005"
"mt0498";"T1027012";1;"LNK Icon Smuggling";"Adversaries may smuggle commands to download malicious payloads past content filters by hiding them within otherwise seemingly benign windows shortcut files. Windows shortcut files (.LNK) include many metadata fields, including an icon location field (also known as the IconEnvironmentDataBlock) designed to specify the path to an icon file that is to be displayed for the LNK file within a host directory.";"TA0005"
"mt0499";"T1027013";1;"Encrypted/Encoded File";"Adversaries may encrypt or encode files to obfuscate strings, bytes, and other specific patterns to impede detection. Encrypting and/or encoding file content aims to conceal malicious artifacts within a file used in an intrusion. Many other techniques, such as Software Packing, Steganography, and Embedded Payloads, share this same broad objective. Encrypting and/or encoding files could lead to a lapse in detection of static signatures, only for this malicious content to be revealed (i.e., Deobfuscate/Decode Files or Information) at the time of execution/use.";"TA0005"
"mt0500";"T1647";1;"Plist File Modification";"Adversaries may modify property list files (plist files) to enable other malicious activity, while also potentially evading and bypassing system defenses. macOS applications use plist files, such as the info.plist file, to store properties and configuration settings that inform the operating system how to handle the application at runtime. Plist files are structured metadata in key-value pairs formatted in XML based on Apple's Core Foundation DTD. Plist files can be saved in text or binary format.";"TA0005"
"mt0501";"T1542";1;"Pre-OS Boot";"Adversaries may abuse Pre-OS Boot mechanisms as a way to establish persistence on a system. During the booting process of a computer, firmware and various startup services are loaded before the operating system. These programs control flow of execution before the operating system takes control.";"TA0005"
"mt0502";"T1542001";1;"System Firmware";"Adversaries may modify system firmware to persist on systems.The BIOS (Basic Input/Output System) and The Unified Extensible Firmware Interface (UEFI) or Extensible Firmware Interface (EFI) are examples of system firmware that operate as the software interface between the operating system and hardware of a computer.";"TA0005"
"mt0503";"T1542002";1;"Component Firmware";"Adversaries may modify component firmware to persist on systems. Some adversaries may employ sophisticated means to compromise computer components and install malicious firmware that will execute adversary code outside of the operating system and main system firmware or BIOS. This technique may be similar to System Firmware but conducted upon other system components/devices that may not have the same capability or level of integrity checking.";"TA0005"
"mt0504";"T1542003";1;"Bootkit";"Adversaries may use bootkits to persist on systems. Bootkits reside at a layer below the operating system and may make it difficult to perform full remediation unless an organization suspects one was used and can act accordingly.";"TA0005"
"mt0505";"T1542004";1;"ROMMONkit";"Adversaries may abuse the ROM Monitor (ROMMON) by loading an unauthorized firmware with adversary code to provide persistent access and manipulate device behavior that is difficult to detect.";"TA0005"
"mt0506";"T1542005";1;"TFTP Boot";"Adversaries may abuse netbooting to load an unauthorized network device operating system from a Trivial File Transfer Protocol (TFTP) server. TFTP boot (netbooting) is commonly used by network administrators to load configuration-controlled network device images from a centralized management server. Netbooting is one option in the boot sequence and can be used to centralize, manage, and control device images.";"TA0005"
"mt0507";"T1055";1;"Process Injection";"Adversaries may inject code into processes in order to evade process-based defenses as well as possibly elevate privileges. Process injection is a method of executing arbitrary code in the address space of a separate live process. Running code in the context of another process may allow access to the process's memory, system/network resources, and possibly elevated privileges. Execution via process injection may also evade detection from security products since the execution is masked under a legitimate process.";"TA0005"
"mt0508";"T1055001";1;"Dynamic-link Library Injection";"Adversaries may inject dynamic-link libraries (DLLs) into processes in order to evade process-based defenses as well as possibly elevate privileges. DLL injection is a method of executing arbitrary code in the address space of a separate live process.";"TA0005"
"mt0509";"T1055002";1;"Portable Executable Injection";"Adversaries may inject portable executables (PE) into processes in order to evade process-based defenses as well as possibly elevate privileges. PE injection is a method of executing arbitrary code in the address space of a separate live process.";"TA0005"
"mt0510";"T1055003";1;"Thread Execution Hijacking";"Adversaries may inject malicious code into hijacked processes in order to evade process-based defenses as well as possibly elevate privileges. Thread Execution Hijacking is a method of executing arbitrary code in the address space of a separate live process.";"TA0005"
"mt0511";"T1055004";1;"Asynchronous Procedure Call";"Adversaries may inject malicious code into processes via the asynchronous procedure call (APC) queue in order to evade process-based defenses as well as possibly elevate privileges. APC injection is a method of executing arbitrary code in the address space of a separate live process.";"TA0005"
"mt0512";"T1055005";1;"Thread Local Storage";"Adversaries may inject malicious code into processes via thread local storage (TLS) callbacks in order to evade process-based defenses as well as possibly elevate privileges. TLS callback injection is a method of executing arbitrary code in the address space of a separate live process.";"TA0005"
"mt0513";"T1055008";1;"Ptrace System Calls";"Adversaries may inject malicious code into processes via ptrace (process trace) system calls in order to evade process-based defenses as well as possibly elevate privileges. Ptrace system call injection is a method of executing arbitrary code in the address space of a separate live process.";"TA0005"
"mt0514";"T1055009";1;"Proc Memory";"Adversaries may inject malicious code into processes via the /proc filesystem in order to evade process-based defenses as well as possibly elevate privileges. Proc memory injection is a method of executing arbitrary code in the address space of a separate live process.";"TA0005"
"mt0515";"T1055011";1;"Extra Window Memory Injection";"Adversaries may inject malicious code into process via Extra Window Memory (EWM) in order to evade process-based defenses as well as possibly elevate privileges. EWM injection is a method of executing arbitrary code in the address space of a separate live process.";"TA0005"
"mt0516";"T1055012";1;"Process Hollowing";"Adversaries may inject malicious code into suspended and hollowed processes in order to evade process-based defenses. Process hollowing is a method of executing arbitrary code in the address space of a separate live process.";"TA0005"
"mt0517";"T1055013";1;"Process Doppelgänging";"Adversaries may inject malicious code into process via process doppelgänging in order to evade process-based defenses as well as possibly elevate privileges. Process doppelgänging is a method of executing arbitrary code in the address space of a separate live process.";"TA0005"
"mt0518";"T1055014";1;"VDSO Hijacking";"Adversaries may inject malicious code into processes via VDSO hijacking in order to evade process-based defenses as well as possibly elevate privileges. Virtual dynamic shared object (vdso) hijacking is a method of executing arbitrary code in the address space of a separate live process.";"TA0005"
"mt0519";"T1055015";1;"ListPlanting";"Adversaries may abuse list-view controls to inject malicious code into hijacked processes in order to evade process-based defenses as well as possibly elevate privileges. ListPlanting is a method of executing arbitrary code in the address space of a separate live process. Code executed via ListPlanting may also evade detection from security products since the execution is masked under a legitimate process.";"TA0005"
"mt0520";"T1620";1;"Reflective Code Loading";"Adversaries may reflectively load code into a process in order to conceal the execution of malicious payloads. Reflective loading involves allocating then executing payloads directly within the memory of the process, vice creating a thread or process backed by a file path on disk (e.g., Shared Modules).";"TA0005"
"mt0521";"T1207";1;"Rogue Domain Controller";"Adversaries may register a rogue Domain Controller to enable manipulation of Active Directory data. DCShadow may be used to create a rogue Domain Controller (DC). DCShadow is a method of manipulating Active Directory (AD) data, including objects and schemas, by registering (or reusing an inactive registration) and simulating the behavior of a DC. Once registered, a rogue DC may be able to inject and replicate changes into AD infrastructure for any domain object, including credentials and keys.";"TA0005"
"mt0522";"T1014";1;"Rootkit";"Adversaries may use rootkits to hide the presence of programs, files, network connections, services, drivers, and other system components. Rootkits are programs that hide the existence of malware by intercepting/hooking and modifying operating system API calls that supply system information.";"TA0005"
"mt0523";"T1553";1;"Subvert Trust Controls";"Adversaries may undermine security controls that will either warn users of untrusted activity or prevent execution of untrusted programs. Operating systems and security products may contain mechanisms to identify programs or websites as possessing some level of trust. Examples of such features would include a program being allowed to run because it is signed by a valid code signing certificate, a program prompting the user with a warning because it has an attribute set from being downloaded from the Internet, or getting an indication that you are about to connect to an untrusted site.";"TA0005"
"mt0524";"T1553001";1;"Gatekeeper Bypass";"Adversaries may modify file attributes and subvert Gatekeeper functionality to evade user prompts and execute untrusted programs. Gatekeeper is a set of technologies that act as layer of Apple’s security model to ensure only trusted applications are executed on a host. Gatekeeper was built on top of File Quarantine in Snow Leopard (10.6, 2009) and has grown to include Code Signing, security policy compliance, Notarization, and more. Gatekeeper also treats applications running for the first time differently than reopened applications.";"TA0005"
"mt0525";"T1553002";1;"Code Signing";"Adversaries may create, acquire, or steal code signing materials to sign their malware or tools. Code signing provides a level of authenticity on a binary from the developer and a guarantee that the binary has not been tampered with. The certificates used during an operation may be created, acquired, or stolen by the adversary. Unlike Invalid Code Signature, this activity will result in a valid signature.";"TA0005"
"mt0526";"T1553003";1;"SIP and Trust Provider Hijacking";"Adversaries may tamper with SIP and trust provider components to mislead the operating system and application control tools when conducting signature validation checks. In user mode, Windows Authenticode digital signatures are used to verify a file's origin and integrity, variables that may be used to establish trust in signed code (ex: a driver with a valid Microsoft signature may be handled as safe). The signature validation process is handled via the WinVerifyTrust application programming interface (API) function, which accepts an inquiry and coordinates with the appropriate trust provider, which is responsible for validating parameters of a signature.";"TA0005"
"mt0527";"T1553004";1;"Install Root Certificate";"Adversaries may install a root certificate on a compromised system to avoid warnings when connecting to adversary controlled web servers. Root certificates are used in public key cryptography to identify a root certificate authority (CA). When a root certificate is installed, the system or application will trust certificates in the root's chain of trust that have been signed by the root certificate. Certificates are commonly used for establishing secure TLS/SSL communications within a web browser. When a user attempts to browse a website that presents a certificate that is not trusted an error message will be displayed to warn the user of the security risk. Depending on the security settings, the browser may not allow the user to establish a connection to the website.";"TA0005"
"mt0528";"T1553005";1;"Mark-of-the-Web Bypass";"Adversaries may abuse specific file formats to subvert Mark-of-the-Web (MOTW) controls. In Windows, when files are downloaded from the Internet, they are tagged with a hidden NTFS Alternate Data Stream (ADS) named Zone.Identifier with a specific value known as the MOTW. Files that are tagged with MOTW are protected and cannot perform certain actions. For example, starting in MS Office 10, if a MS Office file has the MOTW, it will open in Protected View. Executables tagged with the MOTW will be processed by Windows Defender SmartScreen that compares files with an allowlist of well-known executables. If the file is not known/trusted, SmartScreen will prevent the execution and warn the user not to run it.";"TA0005"
