"technique_id";"mitre_code";"technique_category";"technique_name";"technique_description";"tactic_code"
"mt0212";"T1574004";1;"Dylib Hijacking";"Adversaries may execute their own payloads by placing a malicious dynamic library (dylib) with an expected name in a path a victim application searches at runtime. The dynamic loader will try to find the dylibs based on the sequential order of the search paths. Paths to dylibs may be prefixed with @rpath, which allows developers to use relative paths to specify an array of search paths used at runtime based on the location of the executable. Additionally, if weak linking is used, such as the LC_LOAD_WEAK_DYLIB function, an application will still execute even if an expected dylib is not present. Weak linking enables developers to run an application on multiple macOS versions as new APIs are added.";"TA0003"
"mt0213";"T1574005";1;"Executable Installer File Permissions Weakness";"Adversaries may execute their own malicious payloads by hijacking the binaries used by an installer. These processes may automatically execute specific binaries as part of their functionality or to perform other actions. If the permissions on the file system directory containing a target binary, or permissions on the binary itself, are improperly set, then the target binary may be overwritten with another binary using user-level permissions and executed by the original process. If the original process and thread are running under a higher permissions level, then the replaced binary will also execute under higher-level permissions, which could include SYSTEM.";"TA0003"
"mt0214";"T1574006";1;"Dynamic Linker Hijacking";"Adversaries may execute their own malicious payloads by hijacking environment variables the dynamic linker uses to load shared libraries. During the execution preparation phase of a program, the dynamic linker loads specified absolute paths of shared libraries from environment variables and files, such as LD_PRELOAD on Linux or DYLD_INSERT_LIBRARIES on macOS. Libraries specified in environment variables are loaded first, taking precedence over system libraries with the same function name. These variables are often used by developers to debug binaries without needing to recompile, deconflict mapped symbols, and implement custom functions without changing the original library.";"TA0003"
"mt0215";"T1574007";1;"Path Interception by PATH Environment Variable";"Adversaries may execute their own malicious payloads by hijacking environment variables used to load libraries. The PATH environment variable contains a list of directories (User and System) that the OS searches sequentially through in search of the binary that was called from a script or the command line.";"TA0003"
"mt0216";"T1574008";1;"Path Interception by Search Order Hijacking";"Adversaries may execute their own malicious payloads by hijacking the search order used to load other programs. Because some programs do not call other programs using the full path, adversaries may place their own file in the directory where the calling program is located, causing the operating system to launch their malicious software at the request of the calling program.";"TA0003"
"mt0217";"T1574009";1;"Path Interception by Unquoted Path";"Adversaries may execute their own malicious payloads by hijacking vulnerable file path references. Adversaries can take advantage of paths that lack surrounding quotations by placing an executable in a higher level directory within the path, so that Windows will choose the adversary's executable to launch.";"TA0003"
"mt0218";"T1574010";1;"Services File Permissions Weakness";"Adversaries may execute their own malicious payloads by hijacking the binaries used by services. Adversaries may use flaws in the permissions of Windows services to replace the binary that is executed upon service start. These service processes may automatically execute specific binaries as part of their functionality or to perform other actions. If the permissions on the file system directory containing a target binary, or permissions on the binary itself are improperly set, then the target binary may be overwritten with another binary using user-level permissions and executed by the original process. If the original process and thread are running under a higher permissions level, then the replaced binary will also execute under higher-level permissions, which could include SYSTEM.";"TA0003"
"mt0219";"T1574011";1;"Services Registry Permissions Weakness";"Adversaries may execute their own malicious payloads by hijacking the Registry entries used by services. Adversaries may use flaws in the permissions for Registry keys related to services to redirect from the originally specified executable to one that they control, in order to launch their own code when a service starts. Windows stores local service configuration information in the Registry under HKLM\SYSTEM\CurrentControlSet\Services. The information stored under a service's Registry keys can be manipulated to modify a service's execution parameters through tools such as the service controller, sc.exe, PowerShell, or Reg. Access to Registry keys is controlled through access control lists and user permissions.";"TA0003"
"mt0220";"T1574012";1;"COR_PROFILER";"Adversaries may leverage the COR_PROFILER environment variable to hijack the execution flow of programs that load the .NET CLR. The COR_PROFILER is a .NET Framework feature which allows developers to specify an unmanaged (or external of .NET) profiling DLL to be loaded into each .NET process that loads the Common Language Runtime (CLR). These profilers are designed to monitor, troubleshoot, and debug managed code executed by the .NET CLR.";"TA0003"
"mt0221";"T1574013";1;"KernelCallbackTable";"Adversaries may abuse the KernelCallbackTable of a process to hijack its execution flow in order to run their own payloads. The KernelCallbackTable can be found in the Process Environment Block (PEB) and is initialized to an array of graphic functions available to a GUI process once user32.dll is loaded.";"TA0003"
"mt0222";"T1574014";1;"AppDomainManager";"Adversaries may execute their own malicious payloads by hijacking how the .NET AppDomainManager loads assemblies. The .NET framework uses the AppDomainManager class to create and manage one or more isolated runtime environments (called application domains) inside a process to host the execution of .NET applications. Assemblies (.exe or .dll binaries compiled to run as .NET code) may be loaded into an application domain as executable code.";"TA0003"
"mt0223";"T1525";1;"Implant Internal Image";"Adversaries may implant cloud or container images with malicious code to establish persistence after gaining access to an environment. Amazon Web Services (AWS) Amazon Machine Images (AMIs), Google Cloud Platform (GCP) Images, and Azure Images as well as popular container runtimes such as Docker can be implanted or backdoored. Unlike Upload Malware, this technique focuses on adversaries implanting an image in a registry within a victim’s environment. Depending on how the infrastructure is provisioned, this could provide persistent access if the infrastructure provisioning tool is instructed to always use the latest image.";"TA0003"
"mt0224";"T1556";1;"Modify Authentication Process";"Adversaries may modify authentication mechanisms and processes to access user credentials or enable otherwise unwarranted access to accounts. The authentication process is handled by mechanisms, such as the Local Security Authentication Server (LSASS) process and the Security Accounts Manager (SAM) on Windows, pluggable authentication modules (PAM) on Unix-based systems, and authorization plugins on MacOS systems, responsible for gathering, storing, and validating credentials. By modifying an authentication process, an adversary may be able to authenticate to a service or system without using Valid Accounts.";"TA0003"
"mt0225";"T1556001";1;"Domain Controller Authentication";"Adversaries may patch the authentication process on a domain controller to bypass the typical authentication mechanisms and enable access to accounts.";"TA0003"
"mt0226";"T1556002";1;"Password Filter DLL";"Adversaries may register malicious password filter dynamic link libraries (DLLs) into the authentication process to acquire user credentials as they are validated.";"TA0003"
"mt0227";"T1556003";1;"Pluggable Authentication Modules";"Adversaries may modify pluggable authentication modules (PAM) to access user credentials or enable otherwise unwarranted access to accounts. PAM is a modular system of configuration files, libraries, and executable files which guide authentication for many services. The most common authentication module is pam_unix.so, which retrieves, sets, and verifies account authentication information in /etc/passwd and /etc/shadow.";"TA0003"
"mt0228";"T1556004";1;"Network Device Authentication";"Adversaries may use Patch System Image to hard code a password in the operating system, thus bypassing of native authentication mechanisms for local accounts on network devices.";"TA0003"
"mt0229";"T1556005";1;"Reversible Encryption";"An adversary may abuse Active Directory authentication encryption properties to gain access to credentials on Windows systems. The AllowReversiblePasswordEncryption property specifies whether reversible password encryption for an account is enabled or disabled. By default this property is disabled (instead storing user credentials as the output of one-way hashing functions) and should not be enabled unless legacy or other software require it.";"TA0003"
"mt0230";"T1556006";1;"Multi-Factor Authentication";"Adversaries may disable or modify multi-factor authentication (MFA) mechanisms to enable persistent access to compromised accounts.";"TA0003"
"mt0231";"T1556007";1;"Hybrid Identity";"Adversaries may patch, modify, or otherwise backdoor cloud authentication processes that are tied to on-premises user identities in order to bypass typical authentication mechanisms, access credentials, and enable persistent access to accounts.";"TA0003"
"mt0232";"T1556008";1;"Network Provider DLL";"Adversaries may register malicious network provider dynamic link libraries (DLLs) to capture cleartext user credentials during the authentication process. Network provider DLLs allow Windows to interface with specific network protocols and can also support add-on credential management functions. During the logon process, Winlogon (the interactive logon module) sends credentials to the local mpnotify.exe process via RPC. The mpnotify.exe process then shares the credentials in cleartext with registered credential managers when notifying that a logon event is happening.";"TA0003"
"mt0233";"T1556009";1;"Conditional Access Policies";"Adversaries may disable or modify conditional access policies to enable persistent access to compromised accounts. Conditional access policies are additional verifications used by identity providers and identity and access management systems to determine whether a user should be granted access to a resource.";"TA0003"
"mt0234";"T1137";1;"Office Application Startup";"Adversaries may leverage Microsoft Office-based applications for persistence between startups. Microsoft Office is a fairly common application suite on Windows-based operating systems within an enterprise network. There are multiple mechanisms that can be used with Office for persistence when an Office-based application is started";"TA0003"
"mt0235";"T1137001";1;"Office Template Macros";"Adversaries may abuse Microsoft Office templates to obtain persistence on a compromised system. Microsoft Office contains templates that are part of common Office applications and are used to customize styles. The base templates within the application are used each time an application starts.";"TA0003"
"mt0236";"T1137002";1;"Office Test";"Adversaries may abuse the Microsoft Office ""Office Test"" Registry key to obtain persistence on a compromised system. An Office Test Registry location exists that allows a user to specify an arbitrary DLL that will be executed every time an Office application is started. This Registry key is thought to be used by Microsoft to load DLLs for testing and debugging purposes while developing Office applications. This Registry key is not created by default during an Office installation.";"TA0003"
"mt0237";"T1137003";1;"Outlook Forms";"Adversaries may abuse Microsoft Outlook forms to obtain persistence on a compromised system. Outlook forms are used as templates for presentation and functionality in Outlook messages. Custom Outlook forms can be created that will execute code when a specifically crafted email is sent by an adversary utilizing the same custom Outlook form.";"TA0003"
"mt0238";"T1137004";1;"Outlook Home Page";"Adversaries may abuse Microsoft Outlook's Home Page feature to obtain persistence on a compromised system. Outlook Home Page is a legacy feature used to customize the presentation of Outlook folders. This feature allows for an internal or external URL to be loaded and presented whenever a folder is opened. A malicious HTML page can be crafted that will execute code when loaded by Outlook Home Page.";"TA0003"
"mt0239";"T1137005";1;"Outlook Rules";"Adversaries may abuse Microsoft Outlook rules to obtain persistence on a compromised system. Outlook rules allow a user to define automated behavior to manage email messages. A benign rule might, for example, automatically move an email to a particular folder in Outlook if it contains specific words from a specific sender. Malicious Outlook rules can be created that can trigger code execution when an adversary sends a specifically crafted email to that user.";"TA0003"
"mt0240";"T1137006";1;"Add-ins";"Adversaries may abuse Microsoft Office add-ins to obtain persistence on a compromised system. Office add-ins can be used to add functionality to Office programs. There are different types of add-ins that can be used by the various Office products; including Word/Excel add-in Libraries (WLL/XLL), VBA add-ins, Office Component Object Model (COM) add-ins, automation add-ins, VBA Editor (VBE), Visual Studio Tools for Office (VSTO) add-ins, and Outlook add-ins.";"TA0003"
"mt0241";"T1653";1;"Power Settings";"Adversaries may impair a system's ability to hibernate, reboot, or shut down in order to extend access to infected machines. When a computer enters a dormant state, some or all software and hardware may cease to operate which can disrupt malicious activity.";"TA0003"
"mt0242";"T1542";1;"Pre-OS Boot";"Adversaries may abuse Pre-OS Boot mechanisms as a way to establish persistence on a system. During the booting process of a computer, firmware and various startup services are loaded before the operating system. These programs control flow of execution before the operating system takes control.";"TA0003"
"mt0243";"T1542001";1;"System Firmware";"Adversaries may modify system firmware to persist on systems.The BIOS (Basic Input/Output System) and The Unified Extensible Firmware Interface (UEFI) or Extensible Firmware Interface (EFI) are examples of system firmware that operate as the software interface between the operating system and hardware of a computer.";"TA0003"
"mt0244";"T1542002";1;"Component Firmware";"Adversaries may modify component firmware to persist on systems. Some adversaries may employ sophisticated means to compromise computer components and install malicious firmware that will execute adversary code outside of the operating system and main system firmware or BIOS. This technique may be similar to System Firmware but conducted upon other system components/devices that may not have the same capability or level of integrity checking.";"TA0003"
"mt0245";"T1542003";1;"Bootkit";"Adversaries may use bootkits to persist on systems. Bootkits reside at a layer below the operating system and may make it difficult to perform full remediation unless an organization suspects one was used and can act accordingly.";"TA0003"
"mt0246";"T1542004";1;"ROMMONkit";"Adversaries may abuse the ROM Monitor (ROMMON) by loading an unauthorized firmware with adversary code to provide persistent access and manipulate device behavior that is difficult to detect.";"TA0003"
"mt0247";"T1542005";1;"TFTP Boot";"Adversaries may abuse netbooting to load an unauthorized network device operating system from a Trivial File Transfer Protocol (TFTP) server. TFTP boot (netbooting) is commonly used by network administrators to load configuration-controlled network device images from a centralized management server. Netbooting is one option in the boot sequence and can be used to centralize, manage, and control device images.";"TA0003"
"mt0248";"T1053";1;"Scheduled Task/Job";"Adversaries may abuse task scheduling functionality to facilitate initial or recurring execution of malicious code. Utilities exist within all major operating systems to schedule programs or scripts to be executed at a specified date and time. A task can also be scheduled on a remote system, provided the proper authentication is met (ex: RPC and file and printer sharing in Windows environments). Scheduling a task on a remote system typically may require being a member of an admin or otherwise privileged group on the remote system.";"TA0003"
"mt0249";"T1053002";1;"At";"Adversaries may abuse the at utility to perform task scheduling for initial or recurring execution of malicious code. The at utility exists as an executable within Windows, Linux, and macOS for scheduling tasks at a specified time and date. Although deprecated in favor of Scheduled Task's schtasks in Windows environments, using at requires that the Task Scheduler service be running, and the user to be logged on as a member of the local Administrators group.";"TA0003"
"mt0250";"T1053003";1;"Cron";"Adversaries may abuse the cron utility to perform task scheduling for initial or recurring execution of malicious code. The cron utility is a time-based job scheduler for Unix-like operating systems. The crontab file contains the schedule of cron entries to be run and the specified times for execution. Any crontab files are stored in operating system-specific file paths.";"TA0003"
"mt0251";"T1053005";1;"Scheduled Task";"Adversaries may abuse the Windows Task Scheduler to perform task scheduling for initial or recurring execution of malicious code. There are multiple ways to access the Task Scheduler in Windows. The schtasks utility can be run directly on the command line, or the Task Scheduler can be opened through the GUI within the Administrator Tools section of the Control Panel. In some cases, adversaries have used a .NET wrapper for the Windows Task Scheduler, and alternatively, adversaries have used the Windows netapi32 library to create a scheduled task.";"TA0003"
"mt0252";"T1053006";1;"Systemd Timers";"Adversaries may abuse systemd timers to perform task scheduling for initial or recurring execution of malicious code. Systemd timers are unit files with file extension .timer that control services. Timers can be set to run on a calendar event or after a time span relative to a starting point. They can be used as an alternative to Cron in Linux environments. Systemd timers may be activated remotely via the systemctl command line utility, which operates over SSH.";"TA0003"
"mt0253";"T1053007";1;"Container Orchestration Job";"Adversaries may abuse task scheduling functionality provided by container orchestration tools such as Kubernetes to schedule deployment of containers configured to execute malicious code. Container orchestration jobs run these automated tasks at a specific date and time, similar to cron jobs on a Linux system. Deployments of this type can also be configured to maintain a quantity of containers over time, automating the process of maintaining persistence within a cluster.";"TA0003"
"mt0254";"T1505";1;"Server Software Component";"Adversaries may abuse legitimate extensible development features of servers to establish persistent access to systems. Enterprise server applications may include features that allow developers to write and install software or scripts to extend the functionality of the main application. Adversaries may install malicious components to extend and abuse server applications.";"TA0003"
"mt0255";"T1505001";1;"SQL Stored Procedures";"Adversaries may abuse SQL stored procedures to establish persistent access to systems. SQL Stored Procedures are code that can be saved and reused so that database users do not waste time rewriting frequently used SQL queries. Stored procedures can be invoked via SQL statements to the database using the procedure name or via defined events (e.g. when a SQL server application is started/restarted).";"TA0003"
"mt0256";"T1505002";1;"Transport Agent";"Adversaries may abuse Microsoft transport agents to establish persistent access to systems. Microsoft Exchange transport agents can operate on email messages passing through the transport pipeline to perform various tasks such as filtering spam, filtering malicious attachments, journaling, or adding a corporate signature to the end of all outgoing emails. Transport agents can be written by application developers and then compiled to .NET assemblies that are subsequently registered with the Exchange server. Transport agents will be invoked during a specified stage of email processing and carry out developer defined tasks.";"TA0003"
"mt0257";"T1505003";1;"Web Shell";"Adversaries may backdoor web servers with web shells to establish persistent access to systems. A Web shell is a Web script that is placed on an openly accessible Web server to allow an adversary to access the Web server as a gateway into a network. A Web shell may provide a set of functions to execute or a command-line interface on the system that hosts the Web server.";"TA0003"
"mt0258";"T1505004";1;"IIS Components";"Adversaries may install malicious components that run on Internet Information Services (IIS) web servers to establish persistence. IIS provides several mechanisms to extend the functionality of the web servers. For example, Internet Server Application Programming Interface (ISAPI) extensions and filters can be installed to examine and/or modify incoming and outgoing IIS web requests. Extensions and filters are deployed as DLL files that export three functions: Get{Extension/Filter}Version, Http{Extension/Filter}Proc, and (optionally) Terminate{Extension/Filter}. IIS modules may also be installed to extend IIS web servers.";"TA0003"
"mt0259";"T1505005";1;"Terminal Services DLL";"Adversaries may abuse components of Terminal Services to enable persistent access to systems. Microsoft Terminal Services, renamed to Remote Desktop Services in some Windows Server OSs as of 2022, enable remote terminal connections to hosts. Terminal Services allows servers to transmit a full, interactive, graphical user interface to clients via RDP.";"TA0003"
"mt0260";"T1205";1;"Traffic Signaling";"Adversaries may use traffic signaling to hide open ports or other malicious functionality used for persistence or command and control. Traffic signaling involves the use of a magic value or sequence that must be sent to a system to trigger a special response, such as opening a closed port or executing a malicious task. This may take the form of sending a series of packets with certain characteristics before a port will be opened that the adversary can use for command and control. Usually this series of packets consists of attempted connections to a predefined sequence of closed ports (i.e. Port Knocking), but can involve unusual flags, specific strings, or other unique characteristics. After the sequence is completed, opening a port may be accomplished by the host-based firewall, but could also be implemented by custom software.";"TA0003"
"mt0261";"T1205001";1;"Port Knocking";"Adversaries may use port knocking to hide open ports used for persistence or command and control. To enable a port, an adversary sends a series of attempted connections to a predefined sequence of closed ports. After the sequence is completed, opening a port is often accomplished by the host based firewall, but could also be implemented by custom software.";"TA0003"
"mt0262";"T1205002";1;"Socket Filters";"Adversaries may attach filters to a network socket to monitor then activate backdoors used for persistence or command and control. With elevated permissions, adversaries can use features such as the libpcap library to open sockets and install filters to allow or disallow certain types of data to come through the socket. The filter may apply to all traffic passing through the specified network interface (or every interface if not specified). When the network interface receives a packet matching the filter criteria, additional actions can be triggered on the host, such as activation of a reverse shell.";"TA0003"
"mt0263";"T1078";1;"Valid Accounts";"Adversaries may obtain and abuse credentials of existing accounts as a means of gaining Initial Access, Persistence, Privilege Escalation, or Defense Evasion. Compromised credentials may be used to bypass access controls placed on various resources on systems within the network and may even be used for persistent access to remote systems and externally available services, such as VPNs, Outlook Web Access, network devices, and remote desktop. Compromised credentials may also grant an adversary increased privilege to specific systems or access to restricted areas of the network. Adversaries may choose not to use malware or tools in conjunction with the legitimate access those credentials provide to make it harder to detect their presence.";"TA0003"
