"technique_id";"mitre_code";"technique_category";"technique_name";"technique_description";"tactic_code"
"mt0768";"T1104";1;"Multi-Stage Channels";"Adversaries may create multiple stages for command and control that are employed under different conditions or for certain functions. Use of multiple stages may obfuscate the command and control channel to make detection more difficult.";"TA0011"
"mt0769";"T1095";1;"Non-Application Layer Protocol";"Adversaries may use an OSI non-application layer protocol for communication between host and C2 server or among infected hosts within a network. The list of possible protocols is extensive. Specific examples include use of network layer protocols, such as the Internet Control Message Protocol (ICMP), transport layer protocols, such as the User Datagram Protocol (UDP), session layer protocols, such as Socket Secure (SOCKS), as well as redirected/tunneled protocols, such as Serial over LAN (SOL).";"TA0011"
"mt0770";"T1571";1;"Non-Standard Port";"Adversaries may communicate using a protocol and port pairing that are typically not associated. For example, HTTPS over port 8088 or port 587 as opposed to the traditional port 443. Adversaries may make changes to the standard port used by a protocol to bypass filtering or muddle analysis/parsing of network data.";"TA0011"
"mt0771";"T1572";1;"Protocol Tunneling";"Adversaries may tunnel network communications to and from a victim system within a separate protocol to avoid detection/network filtering and/or enable access to otherwise unreachable systems. Tunneling involves explicitly encapsulating a protocol within another. This behavior may conceal malicious traffic by blending in with existing traffic and/or provide an outer layer of encryption (similar to a VPN). Tunneling could also enable routing of network packets that would otherwise not reach their intended destination, such as SMB, RDP, or other traffic that would be filtered by network appliances or not routed over the Internet.";"TA0011"
"mt0772";"T1090";1;"Proxy";"Adversaries may use a connection proxy to direct network traffic between systems or act as an intermediary for network communications to a command and control server to avoid direct connections to their infrastructure. Many tools exist that enable traffic redirection through proxies or port redirection, including HTRAN, ZXProxy, and ZXPortMap. Adversaries use these types of proxies to manage command and control communications, reduce the number of simultaneous outbound network connections, provide resiliency in the face of connection loss, or to ride over existing trusted communications paths between victims to avoid suspicion. Adversaries may chain together multiple proxies to further disguise the source of malicious traffic.";"TA0011"
"mt0773";"T1090001";1;"Internal Proxy";"Adversaries may use an internal proxy to direct command and control traffic between two or more systems in a compromised environment. Many tools exist that enable traffic redirection through proxies or port redirection, including HTRAN, ZXProxy, and ZXPortMap. Adversaries use internal proxies to manage command and control communications inside a compromised environment, to reduce the number of simultaneous outbound network connections, to provide resiliency in the face of connection loss, or to ride over existing trusted communications paths between infected systems to avoid suspicion. Internal proxy connections may use common peer-to-peer (p2p) networking protocols, such as SMB, to better blend in with the environment.";"TA0011"
"mt0774";"T1090002";1;"External Proxy";"Adversaries may use an external proxy to act as an intermediary for network communications to a command and control server to avoid direct connections to their infrastructure. Many tools exist that enable traffic redirection through proxies or port redirection, including HTRAN, ZXProxy, and ZXPortMap. Adversaries use these types of proxies to manage command and control communications, to provide resiliency in the face of connection loss, or to ride over existing trusted communications paths to avoid suspicion.";"TA0011"
"mt0775";"T1090003";1;"Multi-hop Proxy";"Adversaries may chain together multiple proxies to disguise the source of malicious traffic. Typically, a defender will be able to identify the last proxy traffic traversed before it enters their network; the defender may or may not be able to identify any previous proxies before the last-hop proxy. This technique makes identifying the original source of the malicious traffic even more difficult by requiring the defender to trace malicious traffic through several proxies to identify its source.";"TA0011"
"mt0776";"T1090004";1;"Domain Fronting";"Adversaries may take advantage of routing schemes in Content Delivery Networks (CDNs) and other services which host multiple domains to obfuscate the intended destination of HTTPS traffic or traffic tunneled through HTTPS. Domain fronting involves using different domain names in the SNI field of the TLS header and the Host field of the HTTP header. If both domains are served from the same CDN, then the CDN may route to the address specified in the HTTP header after unwrapping the TLS header. A variation of the the technique, ""domainless"" fronting, utilizes a SNI field that is left blank; this may allow the fronting to work even when the CDN attempts to validate that the SNI and HTTP Host fields match (if the blank SNI fields are ignored).";"TA0011"
"mt0777";"T1219";1;"Remote Access Software";"An adversary may use legitimate desktop support and remote access software to establish an interactive command and control channel to target systems within networks. These services, such as VNC, Team Viewer, AnyDesk, ScreenConnect, LogMein, AmmyyAdmin, and other remote monitoring and management (RMM) tools, are commonly used as legitimate technical support software and may be allowed by application control within a target environment.";"TA0011"
"mt0778";"T1205";1;"Traffic Signaling";"Adversaries may use traffic signaling to hide open ports or other malicious functionality used for persistence or command and control. Traffic signaling involves the use of a magic value or sequence that must be sent to a system to trigger a special response, such as opening a closed port or executing a malicious task. This may take the form of sending a series of packets with certain characteristics before a port will be opened that the adversary can use for command and control. Usually this series of packets consists of attempted connections to a predefined sequence of closed ports (i.e. Port Knocking), but can involve unusual flags, specific strings, or other unique characteristics. After the sequence is completed, opening a port may be accomplished by the host-based firewall, but could also be implemented by custom software.";"TA0011"
"mt0779";"T1205001";1;"Port Knocking";"Adversaries may use port knocking to hide open ports used for persistence or command and control. To enable a port, an adversary sends a series of attempted connections to a predefined sequence of closed ports. After the sequence is completed, opening a port is often accomplished by the host based firewall, but could also be implemented by custom software.";"TA0011"
"mt0780";"T1205002";1;"Socket Filters";"Adversaries may attach filters to a network socket to monitor then activate backdoors used for persistence or command and control. With elevated permissions, adversaries can use features such as the libpcap library to open sockets and install filters to allow or disallow certain types of data to come through the socket. The filter may apply to all traffic passing through the specified network interface (or every interface if not specified). When the network interface receives a packet matching the filter criteria, additional actions can be triggered on the host, such as activation of a reverse shell.";"TA0011"
"mt0781";"T1102";1;"Web Service";"Adversaries may use an existing, legitimate external Web service as a means for relaying data to/from a compromised system. Popular websites and social media acting as a mechanism for C2 may give a significant amount of cover due to the likelihood that hosts within a network are already communicating with them prior to a compromise. Using common services, such as those offered by Google or Twitter, makes it easier for adversaries to hide in expected noise. Web service providers commonly use SSL/TLS encryption, giving adversaries an added level of protection.";"TA0011"
"mt0782";"T1102001";1;"Dead Drop Resolver";"Adversaries may use an existing, legitimate external Web service to host information that points to additional command and control (C2) infrastructure. Adversaries may post content, known as a dead drop resolver, on Web services with embedded (and often obfuscated/encoded) domains or IP addresses. Once infected, victims will reach out to and be redirected by these resolvers.";"TA0011"
"mt0783";"T1102002";1;"Bidirectional Communication";"Adversaries may use an existing, legitimate external Web service as a means for sending commands to and receiving output from a compromised system over the Web service channel. Compromised systems may leverage popular websites and social media to host command and control (C2) instructions. Those infected systems can then send the output from those commands back over that Web service channel. The return traffic may occur in a variety of ways, depending on the Web service being utilized. For example, the return traffic may take the form of the compromised system posting a comment on a forum, issuing a pull request to development project, updating a document hosted on a Web service, or by sending a Tweet.";"TA0011"
"mt0784";"T1102003";1;"One-Way Communication";"Adversaries may use an existing, legitimate external Web service as a means for sending commands to a compromised system without receiving return output over the Web service channel. Compromised systems may leverage popular websites and social media to host command and control (C2) instructions. Those infected systems may opt to send the output from those commands back over a different C2 channel, including to another distinct Web service. Alternatively, compromised systems may return no output at all in cases where adversaries want to send instructions to systems and do not want a response.";"TA0011"
"mt0785";"T1020";1;"Automated Exfiltration";"Adversaries may exfiltrate data, such as sensitive documents, through the use of automated processing after being gathered during Collection.";"TA0010"
"mt0786";"T1020001";1;"Traffic Duplication";"Adversaries may leverage traffic mirroring in order to automate data exfiltration over compromised infrastructure. Traffic mirroring is a native feature for some devices, often used for network analysis. For example, devices may be configured to forward network traffic to one or more destinations for analysis by a network analyzer or other monitoring device.";"TA0010"
"mt0787";"T1030";1;"Data Transfer Size Limits";"An adversary may exfiltrate data in fixed size chunks instead of whole files or limit packet sizes below certain thresholds. This approach may be used to avoid triggering network data transfer threshold alerts.";"TA0010"
"mt0788";"T1048";1;"Exfiltration Over Alternative Protocol";"Adversaries may steal data by exfiltrating it over a different protocol than that of the existing command and control channel. The data may also be sent to an alternate network location from the main command and control server.";"TA0010"
"mt0789";"T1048001";1;"Exfiltration Over Symmetric Encrypted Non-C2 Protocol";"Adversaries may steal data by exfiltrating it over a symmetrically encrypted network protocol other than that of the existing command and control channel. The data may also be sent to an alternate network location from the main command and control server.";"TA0010"
"mt0790";"T1048002";1;"Exfiltration Over Asymmetric Encrypted Non-C2 Protocol";"Adversaries may steal data by exfiltrating it over an asymmetrically encrypted network protocol other than that of the existing command and control channel. The data may also be sent to an alternate network location from the main command and control server.";"TA0010"
"mt0791";"T1048003";1;"Exfiltration Over Unencrypted Non-C2 Protocol";"Adversaries may steal data by exfiltrating it over an un-encrypted network protocol other than that of the existing command and control channel. The data may also be sent to an alternate network location from the main command and control server.";"TA0010"
"mt0792";"T1041";1;"Exfiltration Over C2 Channel";"Adversaries may steal data by exfiltrating it over an existing command and control channel. Stolen data is encoded into the normal communications channel using the same protocol as command and control communications.";"TA0010"
"mt0793";"T1011";1;"Exfiltration Over Other Network Medium";"Adversaries may attempt to exfiltrate data over a different network medium than the command and control channel. If the command and control network is a wired Internet connection, the exfiltration may occur, for example, over a WiFi connection, modem, cellular data connection, Bluetooth, or another radio frequency (RF) channel.";"TA0010"
"mt0794";"T1011001";1;"Exfiltration Over Bluetooth";"Adversaries may attempt to exfiltrate data over Bluetooth rather than the command and control channel. If the command and control network is a wired Internet connection, an adversary may opt to exfiltrate data using a Bluetooth communication channel.";"TA0010"
"mt0795";"T1052";1;"Exfiltration Over Physical Medium";"Adversaries may attempt to exfiltrate data via a physical medium, such as a removable drive. In certain circumstances, such as an air-gapped network compromise, exfiltration could occur via a physical medium or device introduced by a user. Such media could be an external hard drive, USB drive, cellular phone, MP3 player, or other removable storage and processing device. The physical medium or device could be used as the final exfiltration point or to hop between otherwise disconnected systems.";"TA0010"
"mt0796";"T1052001";1;"Exfiltration over USB";"Adversaries may attempt to exfiltrate data over a USB connected physical device. In certain circumstances, such as an air-gapped network compromise, exfiltration could occur via a USB device introduced by a user. The USB device could be used as the final exfiltration point or to hop between otherwise disconnected systems.";"TA0010"
"mt0797";"T1567";1;"Exfiltration Over Web Service";"Adversaries may use an existing, legitimate external Web service to exfiltrate data rather than their primary command and control channel. Popular Web services acting as an exfiltration mechanism may give a significant amount of cover due to the likelihood that hosts within a network are already communicating with them prior to compromise. Firewall rules may also already exist to permit traffic to these services.";"TA0010"
"mt0798";"T1567001";1;"Exfiltration to Code Repository";"Adversaries may exfiltrate data to a code repository rather than over their primary command and control channel. Code repositories are often accessible via an API (ex: https://api.github.com). Access to these APIs are often over HTTPS, which gives the adversary an additional level of protection.";"TA0010"
"mt0799";"T1567002";1;"Exfiltration to Cloud Storage";"Adversaries may exfiltrate data to a cloud storage service rather than over their primary command and control channel. Cloud storage services allow for the storage, edit, and retrieval of data from a remote cloud storage server over the Internet.";"TA0010"
"mt0800";"T1567003";1;"Exfiltration to Text Storage Sites";"Adversaries may exfiltrate data to text storage sites instead of their primary command and control channel. Text storage sites, such as pastebin[.]com, are commonly used by developers to share code and other information.";"TA0010"
"mt0801";"T1567004";1;"Exfiltration Over Webhook";"Adversaries may exfiltrate data to a webhook endpoint rather than over their primary command and control channel. Webhooks are simple mechanisms for allowing a server to push data over HTTP/S to a client without the need for the client to continuously poll the server. Many public and commercial services, such as Discord, Slack, and webhook.site, support the creation of webhook endpoints that can be used by other services, such as Github, Jira, or Trello. When changes happen in the linked services (such as pushing a repository update or modifying a ticket), these services will automatically post the data to the webhook endpoint for use by the consuming application.";"TA0010"
"mt0802";"T1029";1;"Scheduled Transfer";"Adversaries may schedule data exfiltration to be performed only at certain times of day or at certain intervals. This could be done to blend traffic patterns with normal activity or availability.";"TA0010"
"mt0803";"T1537";1;"Transfer Data to Cloud Account";"Adversaries may exfiltrate data by transferring the data, including through sharing/syncing and creating backups of cloud environments, to another cloud account they control on the same service.";"TA0010"
"mt0804";"T1531";1;"Account Access Removal";"Adversaries may interrupt availability of system and network resources by inhibiting access to accounts utilized by legitimate users. Accounts may be deleted, locked, or manipulated (ex: changed credentials) to remove access to accounts. Adversaries may also subsequently log off and/or perform a System Shutdown/Reboot to set malicious changes into place.";"TA0040"
"mt0805";"T1485";1;"Data Destruction";"Adversaries may destroy data and files on specific systems or in large numbers on a network to interrupt availability to systems, services, and network resources. Data destruction is likely to render stored data irrecoverable by forensic techniques through overwriting files or data on local and remote drives. Common operating system file deletion commands such as del and rm often only remove pointers to files without wiping the contents of the files themselves, making the files recoverable by proper forensic methodology. This behavior is distinct from Disk Content Wipe and Disk Structure Wipe because individual files are destroyed rather than sections of a storage disk or the disk's logical structure.";"TA0040"
"mt0806";"T1486";1;"Data Encrypted for Impact";"Adversaries may encrypt data on target systems or on large numbers of systems in a network to interrupt availability to system and network resources. They can attempt to render stored data inaccessible by encrypting files or data on local and remote drives and withholding access to a decryption key. This may be done in order to extract monetary compensation from a victim in exchange for decryption or a decryption key (ransomware) or to render data permanently inaccessible in cases where the key is not saved or transmitted.";"TA0040"
"mt0807";"T1565";1;"Data Manipulation";"Adversaries may insert, delete, or manipulate data in order to influence external outcomes or hide activity, thus threatening the integrity of the data. By manipulating data, adversaries may attempt to affect a business process, organizational understanding, or decision making.";"TA0040"
"mt0808";"T1565001";1;"Stored Data Manipulation";"Adversaries may insert, delete, or manipulate data at rest in order to influence external outcomes or hide activity, thus threatening the integrity of the data. By manipulating stored data, adversaries may attempt to affect a business process, organizational understanding, and decision making.";"TA0040"
"mt0809";"T1565002";1;"Transmitted Data Manipulation";"Adversaries may alter data en route to storage or other systems in order to manipulate external outcomes or hide activity, thus threatening the integrity of the data. By manipulating transmitted data, adversaries may attempt to affect a business process, organizational understanding, and decision making.";"TA0040"
"mt0810";"T1565003";1;"Runtime Data Manipulation";"Adversaries may modify systems in order to manipulate the data as it is accessed and displayed to an end user, thus threatening the integrity of the data. By manipulating runtime data, adversaries may attempt to affect a business process, organizational understanding, and decision making.";"TA0040"
"mt0811";"T1491";1;"Defacement";"Adversaries may modify visual content available internally or externally to an enterprise network, thus affecting the integrity of the original content. Reasons for Defacement include delivering messaging, intimidation, or claiming (possibly false) credit for an intrusion. Disturbing or offensive images may be used as a part of Defacement in order to cause user discomfort, or to pressure compliance with accompanying messages.";"TA0040"
"mt0812";"T1491001";1;"Internal Defacement";"An adversary may deface systems internal to an organization in an attempt to intimidate or mislead users, thus discrediting the integrity of the systems. This may take the form of modifications to internal websites, or directly to user systems with the replacement of the desktop wallpaper. Disturbing or offensive images may be used as a part of Internal Defacement in order to cause user discomfort, or to pressure compliance with accompanying messages. Since internally defacing systems exposes an adversary's presence, it often takes place after other intrusion goals have been accomplished.";"TA0040"
"mt0813";"T1491002";1;"External Defacement";"An adversary may deface systems external to an organization in an attempt to deliver messaging, intimidate, or otherwise mislead an organization or users. External Defacement may ultimately cause users to distrust the systems and to question/discredit the system’s integrity. Externally-facing websites are a common victim of defacement; often targeted by adversary and hacktivist groups in order to push a political message or spread propaganda. External Defacement may be used as a catalyst to trigger events, or as a response to actions taken by an organization or government. Similarly, website defacement may also be used as setup, or a precursor, for future attacks such as Drive-by Compromise.";"TA0040"
"mt0814";"T1561";1;"Disk Wipe";"Adversaries may wipe or corrupt raw disk data on specific systems or in large numbers in a network to interrupt availability to system and network resources. With direct write access to a disk, adversaries may attempt to overwrite portions of disk data. Adversaries may opt to wipe arbitrary portions of disk data and/or wipe disk structures like the master boot record (MBR). A complete wipe of all disk sectors may be attempted.";"TA0040"
"mt0815";"T1561001";1;"Disk Content Wipe";"Adversaries may erase the contents of storage devices on specific systems or in large numbers in a network to interrupt availability to system and network resources.";"TA0040"
"mt0816";"T1561002";1;"Disk Structure Wipe";"Adversaries may corrupt or wipe the disk data structures on a hard drive necessary to boot a system, targeting specific critical systems or in large numbers in a network to interrupt availability to system and network resources.";"TA0040"
"mt0817";"T1499";1;"Endpoint Denial of Service";"Adversaries may perform Endpoint Denial of Service (DoS) attacks to degrade or block the availability of services to users. Endpoint DoS can be performed by exhausting the system resources those services are hosted on or exploiting the system to cause a persistent crash condition. Example services include websites, email services, DNS, and web-based applications. Adversaries have been observed conducting DoS attacks for political purposes and to support other malicious activities, including distraction, hacktivism, and extortion.";"TA0040"
"mt0818";"T1499001";1;"OS Exhaustion Flood";"Adversaries may launch a denial of service (DoS) attack targeting an endpoint's operating system (OS). A system's OS is responsible for managing the finite resources as well as preventing the entire system from being overwhelmed by excessive demands on its capacity. These attacks do not need to exhaust the actual resources on a system, the attacks may simply exhaust the limits and available resources that an OS self-imposes.";"TA0040"
"mt0819";"T1499002";1;"Service Exhaustion Flood";"Adversaries may target the different network services provided by systems to conduct a denial of service (DoS). Adversaries often target the availability of DNS and web services, however others have been targeted as well. Web server software can be attacked through a variety of means, some of which apply generally while others are specific to the software being used to provide the service.";"TA0040"
"mt0820";"T1499003";1;"Application Exhaustion Flood";"Adversaries may target resource intensive features of applications to cause a denial of service (DoS), denying availability to those applications. For example, specific features in web applications may be highly resource intensive. Repeated requests to those features may be able to exhaust system resources and deny access to the application or the server itself.";"TA0040"
"mt0821";"T1499004";1;"Application or System Exploitation";"Adversaries may exploit software vulnerabilities that can cause an application or system to crash and deny availability to users. Some systems may automatically restart critical applications and services when crashes occur, but they can likely be re-exploited to cause a persistent denial of service (DoS) condition.";"TA0040"
