"technique_id";"mitre_code";"technique_category";"technique_name";"technique_description";"tactic_code"
"mt0001";"T1595";1;"Active Scanning";"Adversaries may execute active reconnaissance scans to gather information that can be used during targeting. Active scans are those where the adversary probes victim infrastructure via network traffic, as opposed to other forms of reconnaissance that do not involve direct interaction.";"TA0043"
"mt0002";"T1595001";1;"Scanning IP Blocks";"Adversaries may scan victim IP blocks to gather information that can be used during targeting. Public IP addresses may be allocated to organizations by block, or a range of sequential addresses.";"TA0043"
"mt0003";"T1595002";1;"Vulnerability Scanning";"Adversaries may scan victims for vulnerabilities that can be used during targeting. Vulnerability scans typically check if the configuration of a target host/application (ex: software and version) potentially aligns with the target of a specific exploit the adversary may seek to use.";"TA0043"
"mt0004";"T1595003";1;"Wordlist Scanning";"Adversaries may iteratively probe infrastructure using brute-forcing and crawling techniques. While this technique employs similar methods to Brute Force, its goal is the identification of content and infrastructure rather than the discovery of valid credentials. Wordlists used in these scans may contain generic, commonly used names and file extensions or terms specific to a particular software. Adversaries may also create custom, target-specific wordlists using data gathered from other Reconnaissance techniques (ex: Gather Victim Org Information, or Search Victim-Owned Websites).";"TA0043"
"mt0005";"T1592";1;"Gather Victim Host Information";"Adversaries may gather information about the victim's hosts that can be used during targeting. Information about hosts may include a variety of details, including administrative data (ex: name, assigned IP, functionality, etc.) as well as specifics regarding its configuration (ex: operating system, language, etc.).";"TA0043"
"mt0006";"T1592001";1;"Hardware";"Adversaries may gather information about the victim's host hardware that can be used during targeting. Information about hardware infrastructure may include a variety of details such as types and versions on specific hosts, as well as the presence of additional components that might be indicative of added defensive protections (ex: card/biometric readers, dedicated encryption hardware, etc.).";"TA0043"
"mt0007";"T1592002";1;"Software";"Adversaries may gather information about the victim's host software that can be used during targeting. Information about installed software may include a variety of details such as types and versions on specific hosts, as well as the presence of additional components that might be indicative of added defensive protections (ex: antivirus, SIEMs, etc.).";"TA0043"
"mt0008";"T1592003";1;"Firmware";"Adversaries may gather information about the victim's host firmware that can be used during targeting. Information about host firmware may include a variety of details such as type and versions on specific hosts, which may be used to infer more information about hosts in the environment (ex: configuration, purpose, age/patch level, etc.).";"TA0043"
"mt0009";"T1592004";1;"Client Configurations";"Adversaries may gather information about the victim's client configurations that can be used during targeting. Information about client configurations may include a variety of details and settings, including operating system/version, virtualization, architecture (ex: 32 or 64 bit), language, and/or time zone.";"TA0043"
"mt0010";"T1589";1;"Gather Victim Identity Information";"Adversaries may gather information about the victim's identity that can be used during targeting. Information about identities may include a variety of details, including personal data (ex: employee names, email addresses, security question responses, etc.) as well as sensitive details such as credentials or multi-factor authentication (MFA) configurations.";"TA0043"
"mt0011";"T1589001";1;"Credentials";"Adversaries may gather credentials that can be used during targeting. Account credentials gathered by adversaries may be those directly associated with the target victim organization or attempt to take advantage of the tendency for users to use the same passwords across personal and business accounts.";"TA0043"
"mt0012";"T1589002";1;"Email Addresses";"Adversaries may gather email addresses that can be used during targeting. Even if internal instances exist, organizations may have public-facing email infrastructure and addresses for employees.";"TA0043"
"mt0013";"T1589003";1;"Employee Names";"Adversaries may gather employee names that can be used during targeting. Employee names be used to derive email addresses as well as to help guide other reconnaissance efforts and/or craft more-believable lures.";"TA0043"
"mt0014";"T1590";1;"Gather Victim Network Information";"Adversaries may gather information about the victim's networks that can be used during targeting. Information about networks may include a variety of details, including administrative data (ex: IP ranges, domain names, etc.) as well as specifics regarding its topology and operations.";"TA0043"
"mt0015";"T1590001";1;"Domain Properties";"Adversaries may gather information about the victim's network domain(s) that can be used during targeting. Information about domains and their properties may include a variety of details, including what domain(s) the victim owns as well as administrative data (ex: name, registrar, etc.) and more directly actionable information such as contacts (email addresses and phone numbers), business addresses, and name servers.";"TA0043"
"mt0016";"T1590002";1;"DNS";"Adversaries may gather information about the victim's DNS that can be used during targeting. DNS information may include a variety of details, including registered name servers as well as records that outline addressing for a target’s subdomains, mail servers, and other hosts. DNS, MX, TXT, and SPF records may also reveal the use of third party cloud and SaaS providers, such as Office 365, G Suite, Salesforce, or Zendesk.";"TA0043"
"mt0017";"T1590003";1;"Network Trust Dependencies";"Adversaries may gather information about the victim's network trust dependencies that can be used during targeting. Information about network trusts may include a variety of details, including second or third-party organizations/domains (ex: managed service providers, contractors, etc.) that have connected (and potentially elevated) network access.";"TA0043"
"mt0018";"T1590004";1;"Network Topology";"Adversaries may gather information about the victim's network topology that can be used during targeting. Information about network topologies may include a variety of details, including the physical and/or logical arrangement of both external-facing and internal network environments. This information may also include specifics regarding network devices (gateways, routers, etc.) and other infrastructure.";"TA0043"
"mt0019";"T1590005";1;"IP Addresses";"Adversaries may gather the victim's IP addresses that can be used during targeting. Public IP addresses may be allocated to organizations by block, or a range of sequential addresses. Information about assigned IP addresses may include a variety of details, such as which IP addresses are in use. IP addresses may also enable an adversary to derive other details about a victim, such as organizational size, physical location(s), Internet service provider, and or where/how their publicly-facing infrastructure is hosted.";"TA0043"
"mt0020";"T1590006";1;"Network Security Appliances";"Adversaries may gather information about the victim's network security appliances that can be used during targeting. Information about network security appliances may include a variety of details, such as the existence and specifics of deployed firewalls, content filters, and proxies/bastion hosts. Adversaries may also target information about victim network-based intrusion detection systems (NIDS) or other appliances related to defensive cybersecurity operations.";"TA0043"
"mt0021";"T1591";1;"Gather Victim Org Information";"Adversaries may gather information about the victim's organization that can be used during targeting. Information about an organization may include a variety of details, including the names of divisions/departments, specifics of business operations, as well as the roles and responsibilities of key employees.";"TA0043"
"mt0022";"T1591001";1;"Determine Physical Locations";"Adversaries may gather the victim's physical location(s) that can be used during targeting. Information about physical locations of a target organization may include a variety of details, including where key resources and infrastructure are housed. Physical locations may also indicate what legal jurisdiction and/or authorities the victim operates within.";"TA0043"
"mt0023";"T1591002";1;"Business Relationships";"Adversaries may gather information about the victim's business relationships that can be used during targeting. Information about an organization’s business relationships may include a variety of details, including second or third-party organizations/domains (ex: managed service providers, contractors, etc.) that have connected (and potentially elevated) network access. This information may also reveal supply chains and shipment paths for the victim’s hardware and software resources.";"TA0043"
"mt0024";"T1591003";1;"Identify Business Tempo";"Adversaries may gather information about the victim's business tempo that can be used during targeting. Information about an organization’s business tempo may include a variety of details, including operational hours/days of the week. This information may also reveal times/dates of purchases and shipments of the victim’s hardware and software resources.";"TA0043"
"mt0025";"T1591004";1;"Identify Roles";"Adversaries may gather information about identities and roles within the victim organization that can be used during targeting. Information about business roles may reveal a variety of targetable details, including identifiable information for key personnel as well as what data/resources they have access to.";"TA0043"
"mt0026";"T1598";1;"Phishing for Information";"Adversaries may send phishing messages to elicit sensitive information that can be used during targeting. Phishing for information is an attempt to trick targets into divulging information, frequently credentials or other actionable information. Phishing for information is different from Phishing in that the objective is gathering data from the victim rather than executing malicious code.";"TA0043"
"mt0027";"T1598001";1;"Spearphishing Service";"Adversaries may send spearphishing messages via third-party services to elicit sensitive information that can be used during targeting. Spearphishing for information is an attempt to trick targets into divulging information, frequently credentials or other actionable information. Spearphishing for information frequently involves social engineering techniques, such as posing as a source with a reason to collect information (ex: Establish Accounts or Compromise Accounts) and/or sending multiple, seemingly urgent messages.";"TA0043"
"mt0028";"T1598002";1;"Spearphishing Attachment";"Adversaries may send spearphishing messages with a malicious attachment to elicit sensitive information that can be used during targeting. Spearphishing for information is an attempt to trick targets into divulging information, frequently credentials or other actionable information. Spearphishing for information frequently involves social engineering techniques, such as posing as a source with a reason to collect information (ex: Establish Accounts or Compromise Accounts) and/or sending multiple, seemingly urgent messages.";"TA0043"
"mt0029";"T1598003";1;"Spearphishing Link";"Adversaries may send spearphishing messages with a malicious link to elicit sensitive information that can be used during targeting. Spearphishing for information is an attempt to trick targets into divulging information, frequently credentials or other actionable information. Spearphishing for information frequently involves social engineering techniques, such as posing as a source with a reason to collect information (ex: Establish Accounts or Compromise Accounts) and/or sending multiple, seemingly urgent messages.";"TA0043"
"mt0030";"T1598004";1;"Spearphishing Voice";"Adversaries may use voice communications to elicit sensitive information that can be used during targeting. Spearphishing for information is an attempt to trick targets into divulging information, frequently credentials or other actionable information. Spearphishing for information frequently involves social engineering techniques, such as posing as a source with a reason to collect information (ex: Impersonation) and/or creating a sense of urgency or alarm for the recipient.";"TA0043"
"mt0031";"T1597";1;"Search Closed Sources";"Adversaries may search and gather information about victims from closed sources that can be used during targeting. Information about victims may be available for purchase from reputable private sources and databases, such as paid subscriptions to feeds of technical/threat intelligence data. Adversaries may also purchase information from less-reputable sources such as dark web or cybercrime blackmarkets.";"TA0043"
"mt0032";"T1597001";1;"Threat Intel Vendors";"Adversaries may search private data from threat intelligence vendors for information that can be used during targeting. Threat intelligence vendors may offer paid feeds or portals that offer more data than what is publicly reported. Although sensitive details (such as customer names and other identifiers) may be redacted, this information may contain trends regarding breaches such as target industries, attribution claims, and successful TTPs/countermeasures.";"TA0043"
"mt0033";"T1597002";1;"Purchase Technical Data";"Adversaries may purchase technical information about victims that can be used during targeting. Information about victims may be available for purchase within reputable private sources and databases, such as paid subscriptions to feeds of scan databases or other data aggregation services. Adversaries may also purchase information from less-reputable sources such as dark web or cybercrime blackmarkets.";"TA0043"
"mt0034";"T1596";1;"Search Open Technical Databases";"Adversaries may search freely available technical databases for information about victims that can be used during targeting. Information about victims may be available in online databases and repositories, such as registrations of domains/certificates as well as public collections of network data/artifacts gathered from traffic and/or scans.";"TA0043"
"mt0035";"T1596001";1;"DNS/Passive DNS";"Adversaries may search DNS data for information about victims that can be used during targeting. DNS information may include a variety of details, including registered name servers as well as records that outline addressing for a target’s subdomains, mail servers, and other hosts.";"TA0043"
"mt0036";"T1596002";1;"WHOIS";"Adversaries may search public WHOIS data for information about victims that can be used during targeting. WHOIS data is stored by regional Internet registries (RIR) responsible for allocating and assigning Internet resources such as domain names. Anyone can query WHOIS servers for information about a registered domain, such as assigned IP blocks, contact information, and DNS nameservers.";"TA0043"
"mt0037";"T1596003";1;"Digital Certificates";"Adversaries may search public digital certificate data for information about victims that can be used during targeting. Digital certificates are issued by a certificate authority (CA) in order to cryptographically verify the origin of signed content. These certificates, such as those used for encrypted web traffic (HTTPS SSL/TLS communications), contain information about the registered organization such as name and location.";"TA0043"
"mt0038";"T1596004";1;"CDNs";"Adversaries may search content delivery network (CDN) data about victims that can be used during targeting. CDNs allow an organization to host content from a distributed, load balanced array of servers. CDNs may also allow organizations to customize content delivery based on the requestor’s geographical region.";"TA0043"
"mt0039";"T1596005";1;"Scan Databases";"Adversaries may search within public scan databases for information about victims that can be used during targeting. Various online services continuously publish the results of Internet scans/surveys, often harvesting information such as active IP addresses, hostnames, open ports, certificates, and even server banners.";"TA0043"
"mt0040";"T1593";1;"Search Open Websites/Domains";"Adversaries may search freely available websites and/or domains for information about victims that can be used during targeting. Information about victims may be available in various online sites, such as social media, new sites, or those hosting information about business operations such as hiring or requested/rewarded contracts.";"TA0043"
"mt0041";"T1593001";1;"Social Media";"Adversaries may search social media for information about victims that can be used during targeting. Social media sites may contain various information about a victim organization, such as business announcements as well as information about the roles, locations, and interests of staff.";"TA0043"
"mt0042";"T1593002";1;"Search Engines";"Adversaries may use search engines to collect information about victims that can be used during targeting. Search engine services typical crawl online sites to index context and may provide users with specialized syntax to search for specific keywords or specific types of content (i.e. filetypes).";"TA0043"
"mt0043";"T1593003";1;"Code Repositories";"Adversaries may search public code repositories for information about victims that can be used during targeting. Victims may store code in repositories on various third-party websites such as GitHub, GitLab, SourceForge, and BitBucket. Users typically interact with code repositories through a web application or command-line utilities such as git.";"TA0043"
"mt0044";"T1594";1;"Search Victim-Owned Websites";"Adversaries may search websites owned by the victim for information that can be used during targeting. Victim-owned websites may contain a variety of details, including names of departments/divisions, physical locations, and data about key employees such as names, roles, and contact info (ex: Email Addresses). These sites may also have details highlighting business operations and relationships.";"TA0043"
"mt0045";"T1650";1;"Acquire Access";"Adversaries may purchase or otherwise acquire an existing access to a target system or network. A variety of online services and initial access broker networks are available to sell access to previously compromised systems. In some cases, adversary groups may form partnerships to share compromised systems with each other.";"TA0042"
"mt0046";"T1583";1;"Acquire Infrastructure";"Adversaries may buy, lease, rent, or obtain infrastructure that can be used during targeting. A wide variety of infrastructure exists for hosting and orchestrating adversary operations. Infrastructure solutions include physical or cloud servers, domains, and third-party web services. Some infrastructure providers offer free trial periods, enabling infrastructure acquisition at limited to no cost. Additionally, botnets are available for rent or purchase.";"TA0042"
"mt0047";"T1583001";1;"Domains";"Adversaries may acquire domains that can be used during targeting. Domain names are the human readable names used to represent one or more IP addresses. They can be purchased or, in some cases, acquired for free.";"TA0042"
"mt0048";"T1583002";1;"DNS Server";"Adversaries may set up their own Domain Name System (DNS) servers that can be used during targeting. During post-compromise activity, adversaries may utilize DNS traffic for various tasks, including for Command and Control (ex: Application Layer Protocol). Instead of hijacking existing DNS servers, adversaries may opt to configure and run their own DNS servers in support of operations.";"TA0042"
"mt0049";"T1583003";1;"Virtual Private Server";"Adversaries may rent Virtual Private Servers (VPSs) that can be used during targeting. There exist a variety of cloud service providers that will sell virtual machines/containers as a service. By utilizing a VPS, adversaries can make it difficult to physically tie back operations to them. The use of cloud infrastructure can also make it easier for adversaries to rapidly provision, modify, and shut down their infrastructure.";"TA0042"
"mt0050";"T1583004";1;"Server";"Adversaries may buy, lease, rent, or obtain physical servers that can be used during targeting. Use of servers allows an adversary to stage, launch, and execute an operation. During post-compromise activity, adversaries may utilize servers for various tasks, such as watering hole operations in Drive-by Compromise, enabling Phishing operations, or facilitating Command and Control. Instead of compromising a third-party Server or renting a Virtual Private Server, adversaries may opt to configure and run their own servers in support of operations. Free trial periods of cloud servers may also be abused.";"TA0042"
"mt0051";"T1583005";1;"Botnet";"Adversaries may buy, lease, or rent a network of compromised systems that can be used during targeting. A botnet is a network of compromised systems that can be instructed to perform coordinated tasks. Adversaries may purchase a subscription to use an existing botnet from a booter/stresser service. With a botnet at their disposal, adversaries may perform follow-on activity such as large-scale Phishing or Distributed Denial of Service (DDoS).";"TA0042"
"mt0052";"T1583006";1;"Web Services";"Adversaries may register for web services that can be used during targeting. A variety of popular websites exist for adversaries to register for a web-based service that can be abused during later stages of the adversary lifecycle, such as during Command and Control (Web Service), Exfiltration Over Web Service, or Phishing. Using common services, such as those offered by Google or Twitter, makes it easier for adversaries to hide in expected noise. By utilizing a web service, adversaries can make it difficult to physically tie back operations to them.";"TA0042"
"mt0053";"T1583007";1;"Serverless";"Adversaries may purchase and configure serverless cloud infrastructure, such as Cloudflare Workers or AWS Lambda functions, that can be used during targeting. By utilizing serverless infrastructure, adversaries can make it more difficult to attribute infrastructure used during operations back to them.";"TA0042"
"mt0054";"T1583008";1;"Malvertising";"Adversaries may purchase online advertisements that can be abused to distribute malware to victims. Ads can be purchased to plant as well as favorably position artifacts in specific locations online, such as prominently placed within search engine results. These ads may make it more difficult for users to distinguish between actual search results and advertisements. Purchased ads may also target specific audiences using the advertising network’s capabilities, potentially further taking advantage of the trust inherently given to search engines and popular websites.";"TA0042"
"mt0055";"T1586";1;"Compromise Accounts";"Adversaries may compromise accounts with services that can be used during targeting. For operations incorporating social engineering, the utilization of an online persona may be important. Rather than creating and cultivating accounts (i.e. Establish Accounts), adversaries may compromise existing accounts. Utilizing an existing persona may engender a level of trust in a potential victim if they have a relationship, or knowledge of, the compromised persona.";"TA0042"
"mt0056";"T1586001";1;"Social Media Accounts";"Adversaries may compromise social media accounts that can be used during targeting. For operations incorporating social engineering, the utilization of an online persona may be important. Rather than creating and cultivating social media profiles (i.e. Social Media Accounts), adversaries may compromise existing social media accounts. Utilizing an existing persona may engender a level of trust in a potential victim if they have a relationship, or knowledge of, the compromised persona.";"TA0042"
"mt0057";"T1586002";1;"Email Accounts";"Adversaries may compromise email accounts that can be used during targeting. Adversaries can use compromised email accounts to further their operations, such as leveraging them to conduct Phishing for Information, Phishing, or large-scale spam email campaigns. Utilizing an existing persona with a compromised email account may engender a level of trust in a potential victim if they have a relationship with, or knowledge of, the compromised persona. Compromised email accounts can also be used in the acquisition of infrastructure (ex: Domains).";"TA0042"
"mt0058";"T1586003";1;"Cloud Accounts";"Adversaries may compromise cloud accounts that can be used during targeting. Adversaries can use compromised cloud accounts to further their operations, including leveraging cloud storage services such as Dropbox, Microsoft OneDrive, or AWS S3 buckets for Exfiltration to Cloud Storage or to Upload Tools. Cloud accounts can also be used in the acquisition of infrastructure, such as Virtual Private Servers or Serverless infrastructure. Compromising cloud accounts may allow adversaries to develop sophisticated capabilities without managing their own servers.";"TA0042"
